### ISSUE TITLE
virtio-net and FreeBSD bhyve

### ISSUE THREAD

**Issue by hannesm** [Solo5/solo5#94]
even after recent changes (#87 #92 #91), I cannot get the virtio-net to work on bhyve.  Running `test_ping_serve.virtio` results in the following output:
```
            |      ___|
  __|  _ \  |  _ \ __ \
\__ \ (   | | (   |  ) |
____/\___/ _|\___/____/
multiboot: Using memory: 0x100000 - 0x10000000
TSC frequency estimate is 2594415330 Hz
virtio_config: device_id=1, interrupt_line=5
Found virtio network device with MAC: 00 a0 98 cc 6a 96 
net queue size is 1024/1024
Hello, World
Serving ping on 10.0.0.2 / 10.0.0.255 / 255.255.255.255
With MAC: 00:a0:98:cc:6a:96 (no ARP!)
Received non-ping or unsupported packet, dropped
Received ping, sending reply
Received ping, sending reply
```

I do run `ping 10.0.0.255` in another console on the host system.

A `tcpdump -lnxxxi tap0` shows that solo5 is transmitting packets -- but they contain only `0` bytes - but I see an ICMP echo request also twice on the `tap0` interface!?

```
20:48:45.569970 IP 10.0.0.1 > 10.0.0.255: ICMP echo request, id 56643, seq 0, length 64
        0x0000:  ffff ffff ffff 00bd 588c de00 0800 4500
        0x0010:  0054 b723 0000 4001 ae86 0a00 0001 0a00
        0x0020:  00ff 0800 1edd dd43 0000 57d7 069d 0008
        0x0030:  b25f 0809 0a0b 0c0d 0e0f 1011 1213 1415
        0x0040:  1617 1819 1a1b 1c1d 1e1f 2021 2223 2425
        0x0050:  2627 2829 2a2b 2c2d 2e2f 3031 3233 3435
        0x0060:  3637
20:48:45.570021 IP 10.0.0.1 > 10.0.0.255: ICMP echo request, id 56643, seq 0, length 64
        0x0000:  ffff ffff ffff 00bd 588c de00 0800 4500
        0x0010:  0054 b723 0000 4001 ae86 0a00 0001 0a00
        0x0020:  00ff 0800 1edd dd43 0000 57d7 069d 0008
        0x0030:  b25f 0809 0a0b 0c0d 0e0f 1011 1213 1415
        0x0040:  1617 1819 1a1b 1c1d 1e1f 2021 2223 2425
        0x0050:  2627 2829 2a2b 2c2d 2e2f 3031 3233 3435
        0x0060:  3637
20:48:45.571435 00:00:00:00:00:00 > 00:00:00:00:00:00 Null Information, send seq 0, rcv seq 0, Flags [Command], length 46
        0x0000:  0000 0000 0000 0000 0000 0000 0000 0000
        0x0010:  0000 0000 0000 0000 0000 0000 0000 0000
        0x0020:  0000 0000 0000 0000 0000 0000 0000 0000
        0x0030:  0000 0000 0000 0000 0000 0000
20:48:46.570367 IP 10.0.0.1 > 10.0.0.255: ICMP echo request, id 56643, seq 1, length 64
```

**Comment by hannesm** [comment]
seeing that frame twice seems to be common (also happens on a different interface if I ping the broadcast address) and not related to tap / bhyve / solo5

**Comment by hannesm** [comment]
this has been solved, thank you so much!
